{
  "title": "Micronaut Dependency Injection Types",
  "intro": "Constructor, field, and method parameter injection.",
  "authors": ["Sergio del Amo"],
  "tags": ["junit","di"],
  "categories": ["Core Basics"],
  "publicationDate": "2022-09-09",
  "languages": ["JAVA", "GROOVY", "KOTLIN", "PYTHON"],
  "testFramework": "JUNIT",
  "apps": [
    {
      "name": "default",
      "features": [],
      "javaFeatures": ["junit-params"],
      "groovyFeatures": ["junit-params"],
      "kotlinFeatures": ["junit-params"]
    }
  ]
}
