{
  "base": "micronaut-k8s",
  "title": "Service discovery and distributed configuration with Google Kubernetes Engine (GKE)",
  "intro": "Service discovery and distributed configuration in a Micronaut application with Google Kubernetes Engine (GKE)",
  "authors": ["Nemanja Mikic"],
  "tags": ["kubernetes", "service-discovery", "GKE"],
  "zipIncludes": ["api/k8s.yml", "orders/k8s.yml", "users/k8s.yml"],
  "categories": ["Kubernetes", "Service Discovery", "Distributed Configuration"],
  "cloud": "GCP",
  "publicationDate": "2023-09-12",
  "languages": ["JAVA", "GROOVY", "KOTLIN"],
  "apps": [
    {
      "name": "users",
      "features": [],
      "packageName": "example.micronaut"
    },
    {
      "name": "orders",
      "features": [],
      "packageName": "example.micronaut"
    },
    {
      "name": "api",
      "features": [],
      "packageName": "example.micronaut"
    }
  ]
}
