{
  "base": "micronaut-serverless-function-aws-lambda-request-stream-handler-base",
  "title": "Micronaut RequestStreamHandler as a GraalVM Native Executable to AWS Lambda",
  "intro": "Learn how to distribute a Micronaut function with an AWS Lambda RequestStreamHandler built as a GraalVM native executable to an AWS Lambda custom runtime.",
  "authors": ["Sergio del Amo"],
  "tags": [],
  "cloud": "AWS",
  "categories": ["AWS Lambda", "GraalVM"],
  "publicationDate": "2024-01-11",
  "languages": ["JAVA"],
  "apps": [
    {
      "applicationType": "FUNCTION",
      "name": "default",
      "features": ["aws-lambda"],
      "javaFeatures": ["graalvm"],
      "kotlinFeatures": ["graalvm"]
    }
  ]
}
