{
  "title": "Publish Micronaut application logs to Microsoft Azure Monitor Logs",
  "intro": "Learn how to send your Micronaut application Logback logs to Microsoft Azure Monitor Logs.",
  "authors": ["Burt Beckwith"],
  "tags": ["cloud"],
  "cloud": "AZURE",
  "categories": ["Logging"],
  "publicationDate": "2024-08-22",
  "languages": ["JAVA", "GROOVY", "KOTLIN"],
  "apps": [
    {
      "name": "default",
      "features": []
    }
  ]
}
