{
  "title": "Micronaut CRaC",
  "intro": "Learn how to start using CRaC with a Micronaut application.",
  "authors": ["Sergio del Amo"],
  "tags": ["endpoint-info"],
  "categories": ["Coordinated Restore at Checkpoint"],
  "publicationDate": "2023-11-22",
  "languages": ["JAVA", "GROOVY"],
  "apps": [
    {
      "name": "default",
      "features": ["crac", "management"]
    }
  ]
}
