{
  "base": "hello-base",
  "title": "Deploy to Google Cloud Run",
  "intro": "Deploy a Micronaut application to Google Cloud Run, a fully managed serverless platform for containerized applications.",
  "authors": ["Sergio del Amo"],
  "tags": ["cloudrun"],
  "categories": ["Scale to Zero Containers"],
  "cloud": "GCP",
  "publicationDate": "2021-10-01",
  "languages": ["JAVA", "GROOVY", "KOTLIN", "PYTHON"],
  "apps": [
    {
      "name": "default",
      "javaFeatures": ["docker-push-gcr"],
      "kotlinFeatures": ["docker-push-gcr"],
      "groovyFeatures": ["docker-push-gcr"],
      "excludeSource": ["Controller", "Services"],
      "excludeTest": ["ApplicationTest", "DefaultTest"]
    }
  ]
}
