{
  "base": "micronaut-cloud-oidc-base",
  "authors": ["Burt Beckwith"],
  "title": "Authenticate Micronaut application users with OpenID Connect and Oracle IDCS",
  "intro": "Learn how to create a secured Micronaut application and authenticate with OpenID Connect in Oracle Cloud.",
  "tags": ["oracle"],
  "categories": ["Authorization Code"],
  "cloud": "OCI",
  "publicationDate": "2022-03-31",
  "languages": ["JAVA", "GROOVY", "KOTLIN", "PYTHON"]
}
