{
  "title": "Schema Migration with Liquibase",
  "intro": "Learn how to use the Liquibase to manage your schema migrations.",
  "authors": ["Sergio del Amo"],
  "tags": ["database-migration"],
  "categories": ["Schema Migration"],
  "publicationDate": "2021-11-21",
  "languages": ["JAVA", "GROOVY", "KOTLIN", "PYTHON"],
  "apps": [
    {
      "name": "default",
      "features": ["data-jdbc", "liquibase", "postgres", "management", "serialization-jackson", "validation"],
      "javaFeatures": ["graalvm"],
      "kotlinFeatures": ["graalvm"]
    }
  ]
}
