{
  "title": "Try-Confirm/Cancel Transactions across Micronaut Services with Oracle MicroTx",
  "intro": "Learn how to reserve resources in several Micronaut services and confirm or cancel the reservations together with Oracle MicroTx TCC transactions.",
  "authors": [
    "Graeme Rocher"
  ],
  "tags": [
    "oracle",
    "microtx",
    "tcc",
    "distributed-transactions",
    "http-client"
  ],
  "categories": [
    "Patterns",
    "HTTP Client"
  ],
  "publicationDate": "2026-10-25",
  "languages": [
    "JAVA",
    "GROOVY",
    "KOTLIN"
  ],
  "apps": [
    {
      "name": "hotel",
      "features": [
        "serialization-jackson"
      ],
      "invisibleFeatures": [
        "oracledb-microtx"
      ]
    },
    {
      "name": "trip",
      "features": [
        "serialization-jackson",
        "http-client",
        "testcontainers"
      ],
      "invisibleFeatures": [
        "oracledb-microtx"
      ]
    }
  ]
}
