{
  "title": "Step 01 - Micronaut LangChain4j Workshop",
  "base": "micronaut-workshop-langchain4j",
  "intro": "Introduction to Micronaut LangChain4j",
  "authors": ["Sergio del Amo"],
  "languages": ["JAVA"],
  "categories": ["LANGCHAIN4J"],
  "publicationDate": "2026-02-12",
  "apps": [
    {
      "name": "default",
      "features": ["importmap","vaadin-webcomponents","es-module-shims","wc-chatbot","jax-rs", "micronaut-langchain4j-openai", "websocket", "reactor", "awaitility"]
    }
  ]
}
