{
  "title": "Oracle Cloud Infrastructure (OCI) Email Delivery using the Micronaut framework",
  "intro": "Learn how to send an email with Oracle Cloud Infrastructure (OCI) Email Delivery using the Micronaut framework.",
  "authors": ["Hari Krishna Sivvala","Burt Beckwith"],
  "tags": ["oracle", "cloud"],
  "categories": ["Email"],
  "cloud": "OCI",
  "publicationDate": "2022-05-17",
  "languages": ["JAVA", "GROOVY", "KOTLIN", "PYTHON"],
  "apps": [
    {
      "name": "default",
      "excludeSource": ["Controller", "Services"],
      "excludeTest": ["ApplicationTest", "DefaultTest"],
      "features": ["email-javamail", "email-template", "views-thymeleaf", "serialization-jackson", "validation"]
    }
  ]
}
