{
  "title": "Secure a Micronaut application with Cognito",
  "intro": "Learn how to create a Micronaut application and secure it with an Authorization Server provided by Cognito.",
  "authors": ["Sergio del Amo", "Álvaro Sánchez-Mariscal"],
  "tags": ["oauth2", "cognito", "oidc", "security"],
  "cloud": "AWS",
  "categories": [
    "Authorization Code"
  ],
  "publicationDate": "2019-12-24",
  "languages": ["JAVA", "GROOVY", "KOTLIN", "PYTHON"],
  "apps": [
    {
      "name": "default",
      "excludeSource": ["Controller", "Services"],
      "excludeTest": ["ApplicationTest", "DefaultTest"],
      "features": ["security-jwt", "security-oauth2"],
      "jvmFeatures": ["views-thymeleaf"],
      "pythonFeatures": ["views-jinjava"],
      "javaFeatures": ["graalvm"],
      "kotlinFeatures": ["graalvm"]
    }
  ]
}
