{
  "title": "Build a GraphQL chat application with Micronaut GraphQL",
  "intro": "Learn how to expose GraphQL queries, mutations, and subscriptions over graphql-ws with Micronaut GraphQL.",
  "authors": ["Graeme Rocher"],
  "tags": ["graphql", "websocket", "subscriptions"],
  "categories": ["GraphQL"],
  "publicationDate": "2026-04-29",
  "languages": ["JAVA"],
  "apps": [
    {
      "name": "default",
      "features": ["graphql", "websocket", "reactor", "serialization-jackson"]
    }
  ]
}
