{
  "title": "Deploy an HTTP Function to Google Cloud Functions",
  "intro": "Deploy a Micronaut application as an HTTP Function to Google Cloud Functions, a scalable pay-as-you-go functions-as-a-service (FaaS) to run your code with zero server management.",
  "authors": ["Sergio del Amo"],
  "tags": ["cloudfunctions"],
  "categories": ["Serverless"],
  "cloud": "GCP",
  "publicationDate": "2021-10-19",
  "languages": ["JAVA", "GROOVY", "KOTLIN", "PYTHON"],
  "apps": [
    {
      "name": "default",
      "features": ["google-cloud-function"],
      "excludeSource": ["Controller", "Services"],
      "excludeTest": ["ApplicationTest"]
    }
  ]
}
