{
  "title": "Langchain4j OpenAI Prompt Template",
  "intro": "Langchain4j OpenAI Prompt Template",
  "authors": ["Sergio del Amo"],
  "tags": ["testcontainers"],
  "categories": ["AI"],
  "publicationDate": "2026-01-01",
  "languages": ["JAVA"],
  "apps": [
    {
      "excludeTest": ["DefaultTest"],
      "name": "default",
      "features": ["langchain4j-openai", "testcontainers", "validation", "problem-json"],
      "invisibleFeatures": ["wiremock-standalone"]
    }
  ]
}
