{
  "title": "Consul and the Micronaut Framework - Microservices Service Discovery",
  "intro": "Use Consul service discovery to expose your Micronaut applications.",
  "authors": ["Sergio del Amo"],
  "tags": ["consul", "validation", "service-discovery"],
  "categories": ["Service Discovery"],
  "publicationDate": "2018-07-27",
  "languages": ["JAVA", "GROOVY", "KOTLIN", "PYTHON"],
  "apps": [
    {
      "name": "bookcatalogue",
      "excludeTest": ["ApplicationTest", "DefaultTest"],
      "features": ["discovery-consul", "management", "serialization-jackson"],
      "javaFeatures": ["graalvm"],
      "kotlinFeatures": ["graalvm"]
    },
    {
      "name": "bookinventory",
      "excludeTest": ["ApplicationTest", "DefaultTest"],
      "features": ["discovery-consul", "management", "serialization-jackson"],
      "javaFeatures": ["graalvm"],
      "kotlinFeatures": ["graalvm"]
    },
    {
      "name": "bookrecommendation",
      "excludeTest": ["ApplicationTest", "DefaultTest"],
      "features": ["discovery-consul", "management", "reactor", "serialization-jackson", "http-client", "retry"],
      "javaFeatures": ["graalvm"],
      "kotlinFeatures": ["graalvm"]
    }
  ]
}
