{
  "base": "micronaut-oauth2-base",
  "title": "Secure a Micronaut application with GitHub",
  "intro": "Learn how to create a Micronaut application and secure it with an Authorization Server provided by GitHub. Learn how to write your own Authentication Mapper.",
  "authors": ["Sergio del Amo"],
  "tags": ["oauth2", "github", "security"],
  "categories": ["Authorization Code"],
  "publicationDate": "2019-12-26",
  "languages": ["JAVA", "GROOVY", "KOTLIN"],
  "apps": [
    {
      "name": "default",
      "features": ["views-thymeleaf", "security-oauth2", "security-jwt", "reactor", "serialization-jackson", "http-client"],
      "javaFeatures": ["graalvm"],
      "kotlinFeatures": ["graalvm"]
    }
  ]
}
