{
  "title": "Use JSON duality view in Oracle",
  "intro": "Learn how to use JSON duality views in Micronaut",
  "authors": ["Dimitrije Zdravkovic"],
  "tags": ["database", "micronaut-data", "JSON duality view"],
  "categories": ["Data JDBC"],
  "publicationDate": "2025-01-21",
  "languages": ["JAVA", "GROOVY", "KOTLIN"],
  "apps": [
    {
      "name": "default",
      "features": ["data-jdbc", "jdbc-hikari" ,"oracle", "serialization-jackson","validation"],
      "javaFeatures": ["graalvm"],
      "kotlinFeatures": ["graalvm"]
    }
  ]
}
