{
  "title": "Step 02 - LLM configuration",
  "base": "micronaut-workshop-langchain4j",
  "intro": "In this step, we will play with various configurations of the language model (LLM) that we will use in the subsequent steps",
  "authors": ["Sergio del Amo"],
  "languages": ["JAVA"],
  "categories": ["LANGCHAIN4J"],
  "publicationDate": "2026-02-12",
  "apps": [
    {
      "name": "default",
      "features": ["importmap","vaadin-webcomponents","es-module-shims","wc-chatbot","jax-rs", "micronaut-langchain4j-openai", "websocket", "reactor", "awaitility"]
    }
  ]
}
