{
  "title": "Create an Executable JAR of a Micronaut application",
  "intro": "Learn how to generate a distributable Micronaut application artifact.",
  "authors": ["Sergio del Amo"],
  "tags": [],
  "base": "distribution-base",
  "categories": ["Distribution"],
  "publicationDate": "2022-09-16",
  "languages": ["JAVA", "GROOVY", "KOTLIN", "PYTHON"],
  "apps": [
    {
      "name": "default",
      "features": []
    }
  ]
}
