{
  "title": "Find Nearby Delivery Drivers with Micronaut Data JDBC and SQL Server Geospatial",
  "intro": "Learn how to use Micronaut Data JDBC and SQL Server spatial queries to find the closest available delivery driver within 5 km of a food delivery order.",
  "authors": ["Milenko Supic"],
  "tags": ["database", "micronaut-data", "jdbc", "sqlserver", "geospatial"],
  "categories": ["Data JDBC"],
  "publicationDate": "2026-05-29",
  "languages": ["JAVA", "GROOVY", "KOTLIN"],
  "apps": [
    {
      "name": "default",
      "excludeTest": ["DefaultTest"],
      "invisibleFeatures": ["jakarta-persistence-api", "test-resources-long-timeout"],
      "features": ["data-jdbc", "liquibase", "sqlserver", "serialization-jackson", "validation"]
    }
  ]
}