{
  "title": "Micronaut AWS Lambda and a Cron Job",
  "intro": "Learn how to use a scheduled expression with an EventBridge trigger to execute a Micronaut AWS Lambda every 5 minutes",
  "authors": ["Sergio del Amo"],
  "tags": ["lambda", "eventbridge"],
  "cloud": "AWS",
  "categories": ["AWS Lambda", "Scheduling"],
  "publicationDate": "2021-05-27",
  "languages": ["JAVA", "KOTLIN"],
  "testFramework": "JUNIT",
  "maximumJavaVersion": 25,
  "env": { "AWS_ACCESS_KEY_ID": "XXX", "AWS_SECRET_ACCESS_KEY": "YYY", "AWS_REGION": "us-east-1" },
  "apps": [
    {
      "applicationType": "FUNCTION",
      "name": "default",
      "features": ["aws-lambda-scheduled-event"]
    }
  ]
}
