{
  "title": "Building URIs - Spring Boot",
  "intro": "This guide compares using Spring's UriComponentsBuilder vs Micronaut Framework's UriBuilder.",
  "authors": ["Sergio del Amo"],
  "tags": ["spring-boot"],
  "categories": ["Spring Boot"],
  "publicationDate": "2022-09-13",
  "languages": ["JAVA", "KOTLIN"],
  "apps": [
    {
      "framework": "Spring Boot",
      "name": "springboot",
      "features": ["spring-boot-starter-web"]
    },
    {
      "name": "micronautframework",
      "features": []
    }
  ]
}
