{
  "base": "micronaut-cloud-database-base",
  "title": "Connect a Micronaut Data JDBC Application to a Google MySQL Database",
  "intro": "Learn how to connect to a Google MySQL database.",
  "authors": ["John Shingler"],
  "tags": [],
  "cloud": "GCP",
  "categories": ["Data JDBC"],
  "publicationDate": "2022-02-16",
  "apps": [],
  "languages": ["JAVA", "GROOVY", "KOTLIN", "PYTHON"]
}
